<?xml version="1.0" encoding="UTF-8"?>
<values xmlns:xsi="http://www.w3.org/2001/XMLSchema-instance" xsi:noNamespaceSchemaLocation="/InstantView/request/powerProfile.xsd">
	<header>
		<name>Wirkleistung</name>
		<obis>1.25.0</obis>
		<startts>160102171309w</startts>
		<endts>160102171449w</endts>
		<samplerate>1</samplerate>
		<no>100</no>
		<error>false</error>
	</header>
	<v>550</v>
	<v>554</v>
	<v>572</v>
	<v>566</v>
	<v>563</v>
	<v>564</v>
	<v>554</v>
	<v>574</v>
	<v>565</v>
	<v>573</v>
	<v>572</v>
	<v>568</v>
	<v>557</v>
	<v>573</v>
	<v>563</v>
	<v>553</v>
	<v>552</v>
	<v>545</v>
	<v>544</v>
	<v>545</v>
	<v>558</v>
	<v>549</v>
	<v>546</v>
	<v>543</v>
	<v>543</v>
	<v>542</v>
	<v>546</v>
	<v>543</v>
	<v>543</v>
	<v>542</v>
	<v>546</v>
	<v>550</v>
	<v>543</v>
	<v>549</v>
	<v>542</v>
	<v>548</v>
	<v>553</v>
	<v>545</v>
	<v>543</v>
	<v>627</v>
	<v>1150</v>
	<v>543</v>
	<v>547</v>
	<v>545</v>
	<v>542</v>
	<v>542</v>
	<v>1227</v>
	<v>543</v>
	<v>543</v>
	<v>542</v>
	<v>551</v>
	<v>545</v>
	<v>546</v>
	<v>544</v>
	<v>549</v>
	<v>547</v>
	<v>549</v>
	<v>545</v>
	<v>545</v>
	<v>543</v>
	<v>544</v>
	<v>547</v>
	<v>551</v>
	<v>543</v>
	<v>543</v>
	<v>546</v>
	<v>545</v>
	<v>546</v>
	<v>545</v>
	<v>546</v>
	<v>547</v>
	<v>544</v>
	<v>544</v>
	<v>550</v>
	<v>546</v>
	<v>557</v>
	<v>545</v>
	<v>571</v>
	<v>552</v>
	<v>546</v>
	<v>543</v>
	<v>547</v>
	<v>545</v>
	<v>545</v>
	<v>541</v>
	<v>542</v>
	<v>538</v>
	<v>540</v>
	<v>537</v>
	<v>540</v>
	<v>538</v>
	<v>537</v>
	<v>535</v>
	<v>537</v>
	<v>537</v>
	<v>537</v>
	<v>536</v>
	<v>536</v>
	<v>538</v>
	<v>538</v>
</values>
